Work Item Type,Title 1,Title 2,Title 3,Description
User Story,,,S0.7.1 - Map History Kinds To Scenario Families,"<p><strong>User story:</strong></p><ul><li>As the cascade, I need a mapping from formative-event kinds to scenario-library families/templates, so the company&#x27;s past points at the scenarios it should open on.</li></ul><p><strong>Acceptance criteria:</strong></p><ul><li>A documented mapping links history kinds (reorg, layoff, founder exit, scandal, …) to scenario-library families/templates.</li><li>Unknown/absent kinds fall back gracefully (no hard-fail), matching the free-text discipline.</li></ul><p><strong>Dependencies:</strong></p><ul><li>F0.6, Epic 4 (F4.1).</li></ul>"
User Story,,,S0.7.2 - Bias Eligibility And Salience,"<p><strong>User story:</strong></p><ul><li>As the cascade, I need company history to bias Epic 4 scenario eligibility/salience, so the seed ships with hot, grounded opening scenarios.</li></ul><p><strong>Acceptance criteria:</strong></p><ul><li>History biases eligibility/salience over Epic 4&#x27;s export (the history-seeding seam); a recent contested promotion makes that template run hot.</li><li>A different history surfaces different hot scenarios; biasing respects the cast/precondition coverage path (F0.10).</li><li>Output is deterministic.</li></ul><p><strong>Dependencies:</strong></p><ul><li>S0.7.1.</li></ul>"
Feature,,F0.8 - Company Package Export,,"<p><strong>Project phase:</strong> Office-Scale Authoring (Terrarium studio)</p><p><strong>Planning intent:</strong> Make the whole cascade a single new-game seed artifact — a <code>company.json</code> root with the existing payloads as its children.</p><p><strong>Prototype estimate:</strong> serialize <code>company.json</code>; reframe the export bundle as a company package; add <code>CONTRACT.md</code> §3.x + schema bump.</p><p><strong>MVP estimate:</strong> headless CLI export of a full company package; determinism + round-trip tests.</p><p><strong>Goal:</strong> One exportable company package the sim loads as a new game.</p><p><strong>Feature scope:</strong></p><ul><li>New project-level <code>company.json</code> (identity, culture, economic state, mission, history, narrative, climate aggregates).</li><li>The bundle becomes a company package: <code>company.json</code> root + existing org-structure / personas / relationships / layout / scenario(-template) children — no existing payload changes shape.</li><li>Additive contract change; schema bump; §7 compatibility; free-text-with-fallback for new vocabularies.</li><li>Headless export parity with the in-app path (the existing <code>exportAll</code> discipline).</li></ul><p><strong>Done when:</strong></p><ul><li>A generated company exports a deterministic, round-trippable company package; <code>npm run build</code>/<code>test</code> green; contract + schema updated.</li></ul><p><strong>Exit question:</strong></p><pre>Does a generated company export as a deterministic company package the contract documents?</pre>"
User Story,,,S0.8.1 - Serialize company.json And Update The Contract,"<p><strong>User story:</strong></p><ul><li>As the sim, I need a <code>company.json</code> root artifact (identity, culture, economic state, mission, history, narrative, climate aggregates), so a generated company is a loadable thing.</li></ul><p><strong>Acceptance criteria:</strong></p><ul><li><code>company.json</code> serializes the company model; a new <code>CONTRACT.md</code> §3.x documents it.</li><li><code>CURRENT_SCHEMA_VERSION</code> is bumped and §7 compatibility is documented; a migration step is added.</li><li>Round-trip serialize/deserialize is unit-tested.</li></ul><p><strong>Dependencies:</strong></p><ul><li>F0.1.</li></ul>"
User Story,,,S0.8.2 - Reframe The Bundle As A Company Package,"<p><strong>User story:</strong></p><ul><li>As the sim, I need the export bundle reframed as a company package — <code>company.json</code> at the root with the existing payloads as children — so the whole seed loads as one unit.</li></ul><p><strong>Acceptance criteria:</strong></p><ul><li>The bundle places <code>company.json</code> at the root with org-structure / personas / relationships / <code>office-layout.json</code> / <code>scenario(-template).json</code> as children.</li><li>No existing payload changes shape; existing single-scenario exports still load.</li><li>The bundle layout is documented in the contract.</li></ul><p><strong>Dependencies:</strong></p><ul><li>S0.8.1, F0.3, F0.5, F0.6, F0.7.</li></ul>"
User Story,,,S0.8.3 - Headless Export And Determinism Tests,"<p><strong>User story:</strong></p><ul><li>As the build pipeline, I need the company package to export headlessly and deterministically, so art-as-data holds at company scale.</li></ul><p><strong>Acceptance criteria:</strong></p><ul><li>The headless CLI (<code>exportAll</code> path) emits a full company package; in-app and CLI outputs are structurally identical.</li><li>Two runs of the same <code>(seed, archetype, dials)</code> are byte-identical (JSON); <code>npm run build</code>/<code>test</code> green.</li></ul><p><strong>Dependencies:</strong></p><ul><li>S0.8.2.</li></ul>"
Feature,,F0.9 - Company Authoring & Preview UI,,"<p><strong>Project phase:</strong> Office-Scale Authoring (Terrarium studio)</p><p><strong>Planning intent:</strong> A &quot;Company&quot; tab to drive and inspect the cascade — pick an archetype + seed + dials, generate, browse company → departments → people → relationships, and override any field.</p><p><strong>Prototype estimate:</strong> a tab with archetype/seed/dials controls, a generate action, and a read-only company/cascade inspector (the company alone in Pass 1; the full cascade in Pass 2).</p><p><strong>MVP estimate:</strong> per-field overrides, regenerate-subtree, and a preview that surfaces the climate/history and the resulting structure.</p><p><strong>Goal:</strong> Author and inspect a whole company without leaving the studio.</p><p><strong>Feature scope:</strong></p><ul><li>Archetype + seed + dials controls; generate the company (Pass 1) then the full cascade (Pass 2).</li><li>Inspect the cascade (company → departments → people → relationships); override any field with authored-wins semantics.</li><li>Additive — does not regress the existing Characters/Persona/Scene/Employees/Scenario tabs.</li></ul><p><strong>Done when:</strong></p><ul><li>The tab generates, inspects, and overrides a company end-to-end and feeds F0.8 export; existing tabs unaffected.</li></ul><p><strong>Exit question:</strong></p><pre>Can a designer author, inspect, and override a whole company in the tool, then export it?</pre>"
User Story,,,S0.9.1 - Company Tab With Generate Controls,"<p><strong>User story:</strong></p><ul><li>As a designer, I need a &quot;Company&quot; tab with archetype/seed/dials controls and a generate action, so I can produce a company from the studio (Pass 1: the company entity alone).</li></ul><p><strong>Acceptance criteria:</strong></p><ul><li>A new &quot;Company&quot; tab exposes archetype picker, seed field, and dials, plus a generate button.</li><li>Generating shows the resulting company (identity, culture, economic state, mission, history, narrative, climate).</li><li>Additive — the Characters/Persona/Scene/Employees/Scenario tabs are unaffected.</li></ul><p><strong>Dependencies:</strong></p><ul><li>F0.1, F0.2.</li></ul>"
User Story,,,S0.9.2 - Cascade Inspector,"<p><strong>User story:</strong></p><ul><li>As a designer, I need to browse the full cascade — company → departments → people → relationships — so I can see what a seed produced (Pass 2).</li></ul><p><strong>Acceptance criteria:</strong></p><ul><li>The tab inspects the generated cascade tiers (structure, departments, personas, relationship graph).</li><li>The view surfaces the climate/history and the resulting structure legibly.</li></ul><p><strong>Dependencies:</strong></p><ul><li>S0.9.1, F0.3, F0.5, F0.6.</li></ul>"
User Story,,,S0.9.3 - Per-Field Overrides,"<p><strong>User story:</strong></p><ul><li>As a designer, I need to override any generated field with authored-wins semantics, so generation is a starting point, not a straitjacket.</li></ul><p><strong>Acceptance criteria:</strong></p><ul><li>Any field is overridable; overrides survive regeneration of unrelated subtrees and win over derived values.</li><li>Overrides flow into the F0.8 export; existing tabs remain unaffected.</li></ul><p><strong>Dependencies:</strong></p><ul><li>S0.9.2.</li></ul>"
Feature,,F0.10 - Seed Coverage & Drama Validation,,"<p><strong>Project phase:</strong> Office-Scale Authoring (Terrarium studio)</p><p><strong>Planning intent:</strong> Guarantee a generated seed is actually playable and dramatic — structurally sound, scenario-satisfiable, and visibly diverged by its company character.</p><p><strong>Prototype estimate:</strong> validators for structure soundness (extends Epic 2/3 checks), scenario-precondition coverage (extends <code>analyzeTemplateCoverage</code>), and history-edge resolution.</p><p><strong>MVP estimate:</strong> a &quot;drama&quot; check that confirms the company character produced measurable divergence and enough hot, castable scenarios to open on.</p><p><strong>Goal:</strong> A go/no-go signal that a generated company is worth playing.</p><p><strong>Feature scope:</strong></p><ul><li>Structure soundness (every department resolves/has a head, no dangling reports), reusing Epic 2/3 validation.</li><li>Scenario-precondition coverage over the generated cast, extending the Epic 3/4 coverage path.</li><li>History-edge resolution + a divergence check (the culture actually shifted the population/graph).</li></ul><p><strong>Done when:</strong></p><ul><li>The validator flags an unplayable or undramatic seed (too-flat population, uncastable library, dangling structure) and passes a good one; surfaced in the UI.</li></ul><p><strong>Exit question:</strong></p><pre>Does the studio tell you, before export, whether a generated company is playable and dramatic?</pre>"
User Story,,,S0.10.1 - Structure And History-Edge Soundness,"<p><strong>User story:</strong></p><ul><li>As an author, I need the generated seed validated for structural soundness and resolvable history edges, so an export is never silently broken.</li></ul><p><strong>Acceptance criteria:</strong></p><ul><li>Reuses Epic 2/3 validation: every department resolves/has a head, no dangling reports; every history-seeded edge resolves to real agents.</li><li>A deliberately broken seed fails; a good one passes.</li></ul><p><strong>Dependencies:</strong></p><ul><li>F0.6.</li></ul>"
User Story,,,S0.10.2 - Scenario-Precondition Coverage,"<p><strong>User story:</strong></p><ul><li>As a designer, I need coverage analysis over the generated cast, so I know the org can satisfy enough of the scenario-template library to stay playable.</li></ul><p><strong>Acceptance criteria:</strong></p><ul><li>Extends <code>analyzeTemplateCoverage</code> to run over the generated cast + the seeded eligibility (F0.7).</li><li>It flags a cast/library mismatch (too few castable templates) and passes a healthy seed.</li></ul><p><strong>Dependencies:</strong></p><ul><li>F0.7, Epic 3/4 coverage.</li></ul>"
User Story,,,S0.10.3 - Drama / Divergence Check And UI Signal,"<p><strong>User story:</strong></p><ul><li>As a designer, I need a go/no-go signal that a generated company is actually playable and dramatic, surfaced in the Company tab, so I don&#x27;t export a flat seed.</li></ul><p><strong>Acceptance criteria:</strong></p><ul><li>A divergence check confirms company character measurably shifted the population/graph (not a flat spread).</li><li>A &quot;drama&quot; check confirms enough hot, castable opening scenarios exist.</li><li>The combined go/no-go result is surfaced in the UI before export.</li></ul><p><strong>Dependencies:</strong></p><ul><li>S0.10.1, S0.10.2.</li></ul>"
